{
  "case_id": "SG8-515a1c846bf94519b52243512c35bd6b",
  "supplier_id": "S037",
  "agent": "financial",
  "status": "SUCCEEDED",
  "data": {
    "currency": "USD",
    "scope": "Conditional scenario exposure, NOT identified disruption-caused loss",
    "assumed_delay_days": 10,
    "assumed_cancellation_rate": "0",
    "assumed_daily_penalty_rate": "0.001",
    "evaluated_orders": 116,
    "cancelled_units": 0,
    "delayed_units": 890,
    "deferred_revenue": "1617230.41",
    "breakdown": {
      "production_loss_cost": "0.00",
      "lost_revenue": "0.00",
      "expedite_cost": "0.00",
      "alternative_supplier_cost": "0.00",
      "additional_transport_cost": "0.00",
      "inventory_holding_cost": "0.00",
      "stockout_cost": "0.00",
      "penalty_cost": "16172.30",
      "recovery_cost": "0.00",
      "total_cost": "16172.30",
      "revenue_at_risk": "1617230.41",
      "recoverable_value": "0.00",
      "net_financial_impact": "16172.30"
    },
    "incremental_disruption_loss": null,
    "detail": [
      {
        "order_id": "O060741",
        "product_id": "P012",
        "warehouse_id": "W022",
        "uncovered_units": 12,
        "cancelled_units": 0,
        "delayed_units": 12,
        "unit_price_usd": "1259.62",
        "production_cost_per_unit_usd": "1020.92",
        "lost_contribution_usd": "0.00",
        "lost_revenue_usd": "0.00",
        "deferred_revenue_usd": "15115.44",
        "penalty_usd": "151.15",
        "total_scenario_cost_usd": "151.15"
      },
      {
        "order_id": "O018417",
        "product_id": "P080",
        "warehouse_id": "W030",
        "uncovered_units": 3,
        "cancelled_units": 0,
        "delayed_units": 3,
        "unit_price_usd": "1828.94",
        "production_cost_per_unit_usd": "1188.26",
        "lost_contribution_usd": "0.00",
        "lost_revenue_usd": "0.00",
        "deferred_revenue_usd": "5486.82",
        "penalty_usd": "54.87",
        "total_scenario_cost_usd": "54.87"
      },
      {
        "order_id": "O074511",
        "product_id": "P071",
        "warehouse_id": "W021",
        "uncovered_units": 12,
        "cancelled_units": 0,
        "delayed_units": 12,
        "unit_price_usd": "1449.26",
        "production_cost_per_unit_usd": "1033.32",
        "lost_contribution_usd": "0.00",
        "lost_revenue_usd": "0.00",
        "deferred_revenue_usd": "17391.12",
        "penalty_usd": "173.91",
        "total_scenario_cost_usd": "173.91"
      },
      {
        "order_id": "O096166",
        "product_id": "P050",
        "warehouse_id": "W030",
        "uncovered_units": 9,
        "cancelled_units": 0,
        "delayed_units": 9,
        "unit_price_usd": "1681.79",
        "production_cost_per_unit_usd": "1203.99",
        "lost_contribution_usd": "0.00",
        "lost_revenue_usd": "0.00",
        "deferred_revenue_usd": "15136.11",
        "penalty_usd": "151.36",
        "total_scenario_cost_usd": "151.36"
      },
      {
        "order_id": "O019454",
        "product_id": "P058",
        "warehouse_id": "W008",
        "uncovered_units": 1,
        "cancelled_units": 0,
        "delayed_units": 1,
        "unit_price_usd": "1481.9",
        "production_cost_per_unit_usd": "1200.49",
        "lost_contribution_usd": "0.00",
        "lost_revenue_usd": "0.00",
        "deferred_revenue_usd": "1481.90",
        "penalty_usd": "14.82",
        "total_scenario_cost_usd": "14.82"
      },
      {
        "order_id": "O030249",
        "product_id": "P087",
        "warehouse_id": "W017",
        "uncovered_units": 12,
        "cancelled_units": 0,
        "delayed_units": 12,
        "unit_price_usd": "1689.96",
        "production_cost_per_unit_usd": "1173.51",
        "lost_contribution_usd": "0.00",
        "lost_revenue_usd": "0.00",
        "deferred_revenue_usd": "20279.52",
        "penalty_usd": "202.80",
        "total_scenario_cost_usd": "202.80"
      },
      {
        "order_id": "O073019",
        "product_id": "P041",
        "warehouse_id": "W030",
        "uncovered_units": 3,
        "cancelled_units": 0,
        "delayed_units": 3,
        "unit_price_usd": "1836.19",
        "production_cost_per_unit_usd": "1260.36",
        "lost_contribution_usd": "0.00",
        "lost_revenue_usd": "0.00",
        "deferred_revenue_usd": "5508.57",
        "penalty_usd": "55.09",
        "total_scenario_cost_usd": "55.09"
      },
      {
        "order_id": "O023602",
        "product_id": "P063",
        "warehouse_id": "W023",
        "uncovered_units": 10,
        "cancelled_units": 0,
        "delayed_units": 10,
        "unit_price_usd": "2106.53",
        "production_cost_per_unit_usd": "1236.32",
        "lost_contribution_usd": "0.00",
        "lost_revenue_usd": "0.00",
        "deferred_revenue_usd": "21065.30",
        "penalty_usd": "210.65",
        "total_scenario_cost_usd": "210.65"
      },
      {
        "order_id": "O066546",
        "product_id": "P032",
        "warehouse_id": "W008",
        "uncovered_units": 2,
        "cancelled_units": 0,
        "delayed_units": 2,
        "unit_price_usd": "1577.18",
        "production_cost_per_unit_usd": "1211.12",
        "lost_contribution_usd": "0.00",
        "lost_revenue_usd": "0.00",
        "deferred_revenue_usd": "3154.36",
        "penalty_usd": "31.54",
        "total_scenario_cost_usd": "31.54"
      },
      {
        "order_id": "O017572",
        "product_id": "P026",
        "warehouse_id": "W011",
        "uncovered_units": 10,
        "cancelled_units": 0,
        "delayed_units": 10,
        "unit_price_usd": "2151.64",
        "production_cost_per_unit_usd": "1203.84",
        "lost_contribution_usd": "0.00",
        "lost_revenue_usd": "0.00",
        "deferred_revenue_usd": "21516.40",
        "penalty_usd": "215.16",
        "total_scenario_cost_usd": "215.16"
      },
      {
        "order_id": "O031852",
        "product_id": "P086",
        "warehouse_id": "W004",
        "uncovered_units": 6,
        "cancelled_units": 0,
        "delayed_units": 6,
        "unit_price_usd": "1780.69",
        "production_cost_per_unit_usd": "1197.69",
        "lost_contribution_usd": "0.00",
        "lost_revenue_usd": "0.00",
        "deferred_revenue_usd": "10684.14",
        "penalty_usd": "106.84",
        "total_scenario_cost_usd": "106.84"
      },
      {
        "order_id": "O061542",
        "product_id": "P099",
        "warehouse_id": "W008",
        "uncovered_units": 2,
        "cancelled_units": 0,
        "delayed_units": 2,
        "unit_price_usd": "1662.53",
        "production_cost_per_unit_usd": "1207.16",
        "lost_contribution_usd": "0.00",
        "lost_revenue_usd": "0.00",
        "deferred_revenue_usd": "3325.06",
        "penalty_usd": "33.25",
        "total_scenario_cost_usd": "33.25"
      },
      {
        "order_id": "O086828",
        "product_id": "P015",
        "warehouse_id": "W026",
        "uncovered_units": 11,
        "cancelled_units": 0,
        "delayed_units": 11,
        "unit_price_usd": "1904.84",
        "production_cost_per_unit_usd": "1212.05",
        "lost_contribution_usd": "0.00",
        "lost_revenue_usd": "0.00",
        "deferred_revenue_usd": "20953.24",
        "penalty_usd": "209.53",
        "total_scenario_cost_usd": "209.53"
      },
      {
        "order_id": "O028747",
        "product_id": "P015",
        "warehouse_id": "W008",
        "uncovered_units": 2,
        "cancelled_units": 0,
        "delayed_units": 2,
        "unit_price_usd": "1904.84",
        "production_cost_per_unit_usd": "1212.05",
        "lost_contribution_usd": "0.00",
        "lost_revenue_usd": "0.00",
        "deferred_revenue_usd": "3809.68",
        "penalty_usd": "38.10",
        "total_scenario_cost_usd": "38.10"
      },
      {
        "order_id": "O046013",
        "product_id": "P055",
        "warehouse_id": "W006",
        "uncovered_units": 11,
        "cancelled_units": 0,
        "delayed_units": 11,
        "unit_price_usd": "1521.29",
        "production_cost_per_unit_usd": "1128.8",
        "lost_contribution_usd": "0.00",
        "lost_revenue_usd": "0.00",
        "deferred_revenue_usd": "16734.19",
        "penalty_usd": "167.34",
        "total_scenario_cost_usd": "167.34"
      },
      {
        "order_id": "O070691",
        "product_id": "P031",
        "warehouse_id": "W021",
        "uncovered_units": 3,
        "cancelled_units": 0,
        "delayed_units": 3,
        "unit_price_usd": "2221.11",
        "production_cost_per_unit_usd": "1240.27",
        "lost_contribution_usd": "0.00",
        "lost_revenue_usd": "0.00",
        "deferred_revenue_usd": "6663.33",
        "penalty_usd": "66.63",
        "total_scenario_cost_usd": "66.63"
      },
      {
        "order_id": "O075100",
        "product_id": "P071",
        "warehouse_id": "W006",
        "uncovered_units": 5,
        "cancelled_units": 0,
        "delayed_units": 5,
        "unit_price_usd": "1449.26",
        "production_cost_per_unit_usd": "1033.32",
        "lost_contribution_usd": "0.00",
        "lost_revenue_usd": "0.00",
        "deferred_revenue_usd": "7246.30",
        "penalty_usd": "72.46",
        "total_scenario_cost_usd": "72.46"
      },
      {
        "order_id": "O093565",
        "product_id": "P071",
        "warehouse_id": "W030",
        "uncovered_units": 5,
        "cancelled_units": 0,
        "delayed_units": 5,
        "unit_price_usd": "1449.26",
        "production_cost_per_unit_usd": "1033.32",
        "lost_contribution_usd": "0.00",
        "lost_revenue_usd": "0.00",
        "deferred_revenue_usd": "7246.30",
        "penalty_usd": "72.46",
        "total_scenario_cost_usd": "72.46"
      },
      {
        "order_id": "O018173",
        "product_id": "P090",
        "warehouse_id": "W015",
        "uncovered_units": 8,
        "cancelled_units": 0,
        "delayed_units": 8,
        "unit_price_usd": "2191.23",